{
  "version": 1,
  "platform": "swisslifeone",
  "slug": "swisslifeone_login",
  "name": "Connexion SwissLifeOne (HL)",
  "trace": "retain-on-failure",
  "steps": [
    { "type": "goto", "url": "https://www.swisslifeone.fr/", "label": "accueil" },
    { "type": "waitForField", "field": "login_button_home", "label": "wait-login-button" },
    { "type": "clickField", "field": "login_button_home", "label": "click-login-button" },
    { "type": "sleep", "timeout_ms": 2000, "label": "wait-sso-load" },
    { "type": "waitForField", "field": "login_username", "label": "wait-sso-form" },
    { "type": "fillField", "field": "login_username", "value": "{credentials.username}", "label": "fill-user" },
    { "type": "fillField", "field": "login_password", "value": "{credentials.password}", "label": "fill-pass" },
    { "type": "clickField", "field": "login_submit", "label": "submit" },
    { "type": "sleep", "timeout_ms": 2000, "label": "wait-post-login" }
  ]
}
